ORDER,UserLanguage,Consent1,Consent2,Consent3,Consent4,Consent5,T_Consent_First Click,T_Consent_Last Click,T_Consent_Page Submit,T_Consent_Click Count,Prolific_ID,T_Prolific_ID_First Click,T_Prolific_ID_Last Click,T_Prolific_ID_Page Submit,T_Prolific_ID_Click Count,T_Gen_Ins_First Click,T_Gen_Ins_Last Click,T_Gen_Ins_Page Submit,T_Gen_Ins_Click Count,Age,Gender,Nationality,Nationality_3_TEXT,English,English_2_TEXT,City,Profession,Football_1,T_Dem_First Click,T_Dem_Last Click,T_Dem_Page Submit,T_Dem_Click Count,GENERATION_FACTOR,GENERATION_NUMERIC,CHAIN,CHAIN_NUM,CONDITION,INDIVIDUAL,T_READING,T_RECALL,RECALL,PRE_RECALL,RECALL_QUALITATIVE
2,EN-GB,YES,YES,YES,YES,YES,1.832,21.264,22.033,14,5cc1e924b33fe200176b4ef4,1.512,3.921,8.38,2,2.712,4.338,4.884,2,34,Female,UK,,Yes,,Inverness,Supervisor,5,1.618,28.801,29.643,18,F2,2,CH6,6,B,JAMES,6.868,61.315,4,3,He was modest about his football skills. Scored some goals. Was invited to parties by his best friends.
2,EN-GB,YES,YES,YES,YES,YES,5.033,27.728,30.76,10,5d36107704544800196c5d56,5.866,9.828,11.738,2,4.375,4.375,6.014,1,18,Female,UK,,Yes,,Leicester,Student,5,2.361,31.381,33.003,11,F3,3,CH6,6,B,JAMES,6.846,63.634,4,3,James was modest about his football skills. he scored some goals. He was invited to parties by his close friends.
2,EN-GB,YES,YES,YES,YES,YES,1.031,31.982,32.933,28,5d8a4dc174eebd0019efe608,1.726,1.726,4.373,1,1.837,14.206,17.564,6,46,Female,UK,,Yes,,Chesterfield ,Equestrian retailer,5,2.565,43.743,44.813,14,F4,4,CH6,6,B,JAMES,5.942,61.281,3,2,James was a good player he scored a moderate amount of goals and was invited to parties by his close friends
3,EN-GB,YES,YES,YES,YES,YES,23.037,32.958,33.818,6,5a8a8de6000dab00018cc170,19.267,19.426,20.985,2,0,0,6.185,0,31,Female,UK,,Yes,,London,Transcriber,2,0.96,24.515,26.077,7,F1,1,CH6,6,B,BILL,42.868,117.567,9,7,Bill was violent and injured other people. No one liked him. He only got invited to parties because people were scared of him.  He made himself the captain without asking others. He thought that he was a great football player.
3,EN-GB,YES,YES,YES,YES,YES,1.832,21.264,22.033,14,5cc1e924b33fe200176b4ef4,1.512,3.921,8.38,2,2.712,4.338,4.884,2,34,Female,UK,,Yes,,Inverness,Supervisor,5,1.618,28.801,29.643,18,F2,2,CH6,6,B,BILL,8.77,63.093,7,5,He was violent and injured alot of footballers while playing football. He made himself captain without asking anyone else. He was only invited to parties cause people were scared of him
3,EN-GB,YES,YES,YES,YES,YES,5.033,27.728,30.76,10,5d36107704544800196c5d56,5.866,9.828,11.738,2,4.375,4.375,6.014,1,18,Female,UK,,Yes,,Leicester,Student,5,2.361,31.381,33.003,11,F3,3,CH6,6,B,BILL,7.009,75.143,5,4,Bill was very violent and hurt a lot of the other players and was an average player. he only got invited to parties because people were scared of him.
3,EN-GB,YES,YES,YES,YES,YES,1.031,31.982,32.933,28,5d8a4dc174eebd0019efe608,1.726,1.726,4.373,1,1.837,14.206,17.564,6,46,Female,UK,,Yes,,Chesterfield ,Equestrian retailer,5,2.565,43.743,44.813,14,F4,4,CH6,6,B,BILL,7.292,61.663,4,3,Bill was a violent and nasty player who hardly scored goals people only invited him to their parties as they were scared of him
1,EN-GB,YES,YES,YES,YES,YES,12.089,20.826,21.924,7,5d3c70a80e55ba001a1cd206,6.241,7.794,9.784,2,0,0,7.309,0,32,Female,UK,,Yes,,York,Stage manager,2,2.027,25.413,26.759,11,F1,1,CH7,7,B,JOHN,39.053,75.449,11,9,"John is the most popular footballer and the best on the team, he is super skilled and scored the most goals. Everyone listens to him and makes good eye contact. They unanimously voted to make him captain. He takes other people's opinions into consideration and is popular both as a captain and in his personal life. Everyone invites him to parties and respects him a lot."
1,EN-GB,YES,YES,YES,YES,YES,0.846,11.365,12.151,20,56ce42d9465e580006846f57,1.443,1.443,3.396,1,4.483,6.496,8.61,5,51,Male,UK,,Yes,,Newcastle-upon-Tyne,Senior charity manager ,7,1.8,27.349,28.336,18,F2,2,CH7,7,B,JOHN,19.2,170.98,6,5,John is the best footballer in the team and very popular. People make lots of eye contact with him. He listens to others peoples opinions and is open. He is popular in his personal life too and has lots of friends and is invited to lots of parties. 
1,EN-GB,YES,YES,YES,YES,YES,9.068,19.563,29.501,5,5bfc67e16fe16d0001671066,8.99,8.99,11.422,1,0,0,25.646,0,46,Female,UK,,Yes,,birmingham,lab technician,1,1.496,32.733,33.657,9,F3,3,CH7,7,B,JOHN,7.934,120.613,3,3,"well liked
popular
lots of eye contact
respected"
1,EN-GB,YES,YES,YES,YES,YES,7.546,19.781,21.078,5,5c87e674c558df0014565c72,6.104,6.104,7.885,1,0,0,8.277,0,43,Male,UK,,Yes,,Brighton,New Business Manager,5,1.718,22.066,22.844,8,F4,4,CH7,7,B,JOHN,16.669,61.029,1,1,Well Liked - cant remember much else?
2,EN-GB,YES,YES,YES,YES,YES,12.089,20.826,21.924,7,5d3c70a80e55ba001a1cd206,6.241,7.794,9.784,2,0,0,7.309,0,32,Female,UK,,Yes,,York,Stage manager,2,2.027,25.413,26.759,11,F1,1,CH7,7,B,JAMES,38.209,69.396,10,8,"James is moderately well liked, and moderately good at football, people neither like or dislike him. He wanted to be captain, but he only got two votes. He is modest and gives everyone else's opinions a very high importance. People do listen to what he says in meetings, but they tend not to make eye contact for long. In his personal life, his good friends invite him to parties because they like spending time with him."
2,EN-GB,YES,YES,YES,YES,YES,0.846,11.365,12.151,20,56ce42d9465e580006846f57,1.443,1.443,3.396,1,4.483,6.496,8.61,5,51,Male,UK,,Yes,,Newcastle-upon-Tyne,Senior charity manager ,7,1.8,27.349,28.336,18,F2,2,CH7,7,B,JAMES,14.651,174.643,3,3,James got two votes for the captain job. He is popular aand gets invited to parties because people like his company. He is listened too but not all the time and he is quite a quiet character. 
2,EN-GB,YES,YES,YES,YES,YES,9.068,19.563,29.501,5,5bfc67e16fe16d0001671066,8.99,8.99,11.422,1,0,0,25.646,0,46,Female,UK,,Yes,,birmingham,lab technician,1,1.496,32.733,33.657,9,F3,3,CH7,7,B,JAMES,4.685,83.573,0,0,"well liked
lots of eye contact
quiet
respected"
2,EN-GB,YES,YES,YES,YES,YES,7.546,19.781,21.078,5,5c87e674c558df0014565c72,6.104,6.104,7.885,1,0,0,8.277,0,43,Male,UK,,Yes,,Brighton,New Business Manager,5,1.718,22.066,22.844,8,F4,4,CH7,7,B,JAMES,32.611,90.862,0,0,Popular and quiet. Well respected.
3,EN-GB,YES,YES,YES,YES,YES,12.089,20.826,21.924,7,5d3c70a80e55ba001a1cd206,6.241,7.794,9.784,2,0,0,7.309,0,32,Female,UK,,Yes,,York,Stage manager,2,2.027,25.413,26.759,11,F1,1,CH7,7,B,BILL,35.664,80.177,13,11,"Bill is scary and violent. He injured 2 of his teammates during practise sessions, and everyone is afraid of him. He appointed himself captain without taking anyone else's feelings into account, and he never listens to his teammates in meeting either. People listen to what he says closely, but keep their eyes averted, because they're afraid of him. He thinks he's the best on the team. Nobody likes him, but they invite him to parties and events because they don't want to risk making him angry."
3,EN-GB,YES,YES,YES,YES,YES,0.846,11.365,12.151,20,56ce42d9465e580006846f57,1.443,1.443,3.396,1,4.483,6.496,8.61,5,51,Male,UK,,Yes,,Newcastle-upon-Tyne,Senior charity manager ,7,1.8,27.349,28.336,18,F2,2,CH7,7,B,BILL,25.02,161.226,8,7,Bill is aggressive and nasty and has injured team mates before. People do not make eye contact and are scared of him. He gets invited to parties because people don't want to upset him but he is not popular. 
3,EN-GB,YES,YES,YES,YES,YES,9.068,19.563,29.501,5,5bfc67e16fe16d0001671066,8.99,8.99,11.422,1,0,0,25.646,0,46,Female,UK,,Yes,,birmingham,lab technician,1,1.496,32.733,33.657,9,F3,3,CH7,7,B,BILL,4.532,67.422,4,4,"aggressive
not liked but people are scared of him
hurts people when playing"
3,EN-GB,YES,YES,YES,YES,YES,7.546,19.781,21.078,5,5c87e674c558df0014565c72,6.104,6.104,7.885,1,0,0,8.277,0,43,Male,UK,,Yes,,Brighton,New Business Manager,5,1.718,22.066,22.844,8,F4,4,CH7,7,B,BILL,3.567,64.169,4,4,A bully. Not liked locally but scares people. Hurts people when he plays.
1,EN-GB,YES,YES,YES,YES,YES,6.802,24.049,24.864,26,5c649031eb14eb0001d5f5d7,0.913,3.977,4.746,4,1.349,9.909,10.293,19,21,Male,UK,,Yes,,Cardiff,Student,1,0.912,19.768,21.033,13,F1,1,CH8,8,B,JOHN,21.376,132.265,11,9,"He is an above average footballer, he scored he most goals of his team during the last league. He is respected by his team. Unanimously voted captain of the team by his peers. The other players hold his footballing ability in high regard, striving to copy his style and to listen to him during practice. At meetings the team listens to him with their eyes fixed upon him. He gets frequently invited to parties because people wish to spend time with him."
1,EN-GB,YES,YES,YES,YES,YES,5.705,34.938,36.3,16,5d3df84e807d3500014e3496,1.201,1.579,4.384,2,0,0,15.018,0,34,Female,UK,,Yes,,York,Events Manager,1,2.127,31.53,32.817,11,F2,2,CH8,8,B,JOHN,32.699,72.864,7,6,John is a great footballer. His is highly regarded by his team and they make eye contact with him in meetings. He is invited to all of the parties as people want to spend time with him. He scored the most goals for the team in the last season
1,EN-GB,YES,YES,YES,YES,YES,2.286,33.186,34.777,15,5c963847e751090015dbaf9f,4.926,6.876,7.783,2,8.8,8.8,9.701,1,55,Female,UK,,Yes,,Southampton,Retired,3,3.384,42.884,44.445,16,F3,3,CH8,8,B,JOHN,12.897,99.18,7,6,"John is a good footballer, a popular person, gets listened to in meetings because everyone respects him and gets invited to all of the parties. He is the team's best goalscorer."
1,EN-GB,YES,YES,YES,YES,YES,10.791,90.887,91.866,40,5b9f7e3d00815d00010323f6,2.208,2.208,4.718,1,4.732,25.284,25.872,6,24,Male,UK,,Yes,,Leicester,Computing Freelance,7,2.739,81.22,81.967,51,F4,4,CH8,8,B,JOHN,28.02,153.793,5,4,John is the best top goal scorer at the club. He's gets listened to at meetings and gets invited to all the parties. He is the most popular player.
2,EN-GB,YES,YES,YES,YES,YES,6.802,24.049,24.864,26,5c649031eb14eb0001d5f5d7,0.913,3.977,4.746,4,1.349,9.909,10.293,19,21,Male,UK,,Yes,,Cardiff,Student,1,0.912,19.768,21.033,13,F1,1,CH8,8,B,JAMES,18.682,117.054,9,7,"James is average. He scored a few goals for his team during the last few games. He wanted to become captain of the team, but only recieved two votes so wasnt selected. At meetings he is often disregarded. He holds his teammates in high regard, especially their football skills. He isnt often invited to parties. But always invited by his close friends who want to hang out wit him."
2,EN-GB,YES,YES,YES,YES,YES,5.705,34.938,36.3,16,5d3df84e807d3500014e3496,1.201,1.579,4.384,2,0,0,15.018,0,34,Female,UK,,Yes,,York,Events Manager,1,2.127,31.53,32.817,11,F2,2,CH8,8,B,JAMES,18.268,69.202,7,5,"James is an average footballer. He wanted to be team captain but only got two votes. He gets invited to some of the parties, however his closest friends always invite him as they want to spend time with him. He has scored a few goals for his team"
2,EN-GB,YES,YES,YES,YES,YES,2.286,33.186,34.777,15,5c963847e751090015dbaf9f,4.926,6.876,7.783,2,8.8,8.8,9.701,1,55,Female,UK,,Yes,,Southampton,Retired,3,3.384,42.884,44.445,16,F3,3,CH8,8,B,JAMES,9.856,153.647,6,4,"James is an average footballer, scores some goals, people do listen to him in meetings but do not make eye contact. James isn't particularly popular, only gets invited to some of the parties (although his own personal friends like him very much). He thinks he should be the captain."
2,EN-GB,YES,YES,YES,YES,YES,10.791,90.887,91.866,40,5b9f7e3d00815d00010323f6,2.208,2.208,4.718,1,4.732,25.284,25.872,6,24,Male,UK,,Yes,,Leicester,Computing Freelance,7,2.739,81.22,81.967,51,F4,4,CH8,8,B,JAMES,32.967,148.321,3,1,"James is a very average player. He gets listened to at meetings but no one shows him eye contact. He wants to be captain though he gets invited to parties, he's not close with the other players."
3,EN-GB,YES,YES,YES,YES,YES,6.802,24.049,24.864,26,5c649031eb14eb0001d5f5d7,0.913,3.977,4.746,4,1.349,9.909,10.293,19,21,Male,UK,,Yes,,Cardiff,Student,1,0.912,19.768,21.033,13,F1,1,CH8,8,B,BILL,16.888,116.074,11,9,"Bill is violent, injuring two of his own teammates during the teams last training sesion. He is unliked by his teammates. He awarded himself the title of team captain. He believes himself to be the best at football. At meetings his teammates listen to him, but usually avoid eye contact as the dont want to anger him. He frequently gets invited to parties as his teammates dont want him to be angry at them."
3,EN-GB,YES,YES,YES,YES,YES,5.705,34.938,36.3,16,5d3df84e807d3500014e3496,1.201,1.579,4.384,2,0,0,15.018,0,34,Female,UK,,Yes,,York,Events Manager,1,2.127,31.53,32.817,11,F2,2,CH8,8,B,BILL,16.881,94.964,10,8,"Bill is a violent player, injuring two of his team mates a the training sessions. People listen to him in meetings but don't make eye contact as they do not wish to anger him. Bill gets invited to all the parties. Bill thinks he is the best footballer, and appointed himself as team captain. "
3,EN-GB,YES,YES,YES,YES,YES,2.286,33.186,34.777,15,5c963847e751090015dbaf9f,4.926,6.876,7.783,2,8.8,8.8,9.701,1,55,Female,UK,,Yes,,Southampton,Retired,3,3.384,42.884,44.445,16,F3,3,CH8,8,B,BILL,11.456,162.457,8,6,"Bill is a violent player with a temper. He is not a particularly good footballer but has made himself captain and no-one is going to argue because they are all afraid of him, the same reason why they listen to him at meetings and invite him to all the parties. He is a violent thug, a poor player and does not benefit the team."
3,EN-GB,YES,YES,YES,YES,YES,10.791,90.887,91.866,40,5b9f7e3d00815d00010323f6,2.208,2.208,4.718,1,4.732,25.284,25.872,6,24,Male,UK,,Yes,,Leicester,Computing Freelance,7,2.739,81.22,81.967,51,F4,4,CH8,8,B,BILL,24.985,169.011,7,6,Bill is a violent player with a bad temper. He is not a good footballer but he made himself captain of the club so no one argues with him as they're all afraid of him. This is the reason why hes gets listened to at meetings and gets invited to parties.
1,EN-GB,YES,YES,YES,YES,YES,14.97,27.802,28.91,5,5aeb19f123e2ca0001973cad,1.972,4.228,6.137,3,0,0,16.899,0,30,Male,UK,,Yes,,Wolverhampton,Web Designer,7,1.849,108.216,108.931,7,F1,1,CH9,9,B,JOHN,29.998,119.681,11,9,"He's the best player in the team but modest with it. He is admired, respected and liked by his teammates, and was elected captain unanimously. People pay attention to his opinions and make eye contact with him. People invite him to parties because they enjoy his company."
1,EN-GB,YES,YES,YES,YES,YES,11.105,21.691,23.452,5,5ab9b5b147a9f7000153b64a,8.254,8.254,11.682,1,0,0,11.268,0,60,Female,UK,,Yes,,LIVERPOOL,district nurse,4,1.736,33.16,34.818,10,F2,2,CH9,9,B,JOHN,15.711,87.9,5,4,john is well liked by his team mates. he was elected captain unanimous. he maintains eye contact with his colleges. he is invited to party's and is well liked and respected by his team mates.  
1,EN-GB,YES,YES,YES,YES,YES,3.175,19.867,22.128,6,59ca00dd81eacc000137f6fe,2.097,4.825,5.127,2,0,0,7.19,0,21,Female,UK,,Yes,,Bournemouth,Student ,7,2.887,15.915,16.548,5,F3,3,CH9,9,B,JOHN,6.504,62.821,4,3,John is universally popular and was unanimously voted to be captain if his team. He is liked a lot and is invited to social events. He has eye contact with all his team mates. 
1,EN-GB,YES,YES,YES,YES,YES,2.565,31.462,33.03,40,  5713e3c44cfd6f0013aa74d0  ,5.294,58.91,60.292,7,2.278,3.055,4.326,5,58,Female,UK,,Yes,,london,sales supervisor,4,2.883,41.726,43.411,35,F4,4,CH9,9,B,JOHN,12.12,73.958,2,2,"john was liked a lot, he was voted for. "
2,EN-GB,YES,YES,YES,YES,YES,14.97,27.802,28.91,5,5aeb19f123e2ca0001973cad,1.972,4.228,6.137,3,0,0,16.899,0,30,Male,UK,,Yes,,Wolverhampton,Web Designer,7,1.849,108.216,108.931,7,F1,1,CH9,9,B,JAMES,74.84,92.905,7,6,He is an average player and his teammates don't have strong opinions about him either way. He doesn't hold much influence over his teammates and only received a small number of votes to be captain. His closest friends enjoy his company but overall he isn't particularly popular.
2,EN-GB,YES,YES,YES,YES,YES,11.105,21.691,23.452,5,5ab9b5b147a9f7000153b64a,8.254,8.254,11.682,1,0,0,11.268,0,60,Female,UK,,Yes,,LIVERPOOL,district nurse,4,1.736,33.16,34.818,10,F2,2,CH9,9,B,JAMES,10.046,140.334,2,2,James is liked by his team mates. He did not get a unanimous vote to be captain. although he is liked by his team mates there are some that do not like him as much. He is not very popular to be invited to social events. He does have eye contact with his team mates.
2,EN-GB,YES,YES,YES,YES,YES,3.175,19.867,22.128,6,59ca00dd81eacc000137f6fe,2.097,4.825,5.127,2,0,0,7.19,0,21,Female,UK,,Yes,,Bournemouth,Student ,7,2.887,15.915,16.548,5,F3,3,CH9,9,B,JAMES,9.319,68.457,1,1,James was unanimously voted as captain. He is liked but there are some people who do not like him. He isn't really invited to social events. James has eye contact with his team-mates. 
2,EN-GB,YES,YES,YES,YES,YES,2.565,31.462,33.03,40,  5713e3c44cfd6f0013aa74d0  ,5.294,58.91,60.292,7,2.278,3.055,4.326,5,58,Female,UK,,Yes,,london,sales supervisor,4,2.883,41.726,43.411,35,F4,4,CH9,9,B,JAMES,12.987,61.751,1,1,James was liked a bit he was voted for too.
3,EN-GB,YES,YES,YES,YES,YES,14.97,27.802,28.91,5,5aeb19f123e2ca0001973cad,1.972,4.228,6.137,3,0,0,16.899,0,30,Male,UK,,Yes,,Wolverhampton,Web Designer,7,1.849,108.216,108.931,7,F1,1,CH9,9,B,BILL,35.853,104.196,8,7,"He is not a nice person and his teammates are afraid of him. He's violent, having injured teammates in training previously, and he's egotistical, having elected himself captain without the support of his teammates. His teammates listen to him but only out of fear, and as such don't like making eye contact with him."
3,EN-GB,YES,YES,YES,YES,YES,11.105,21.691,23.452,5,5ab9b5b147a9f7000153b64a,8.254,8.254,11.682,1,0,0,11.268,0,60,Female,UK,,Yes,,LIVERPOOL,district nurse,4,1.736,33.16,34.818,10,F2,2,CH9,9,B,BILL,9.957,62.239,3,3,Bill is not very popular. He is aggressive in his manner. He is not a popular captain of the team. He does not maintain eye contact with his team mates and he is not invited to social events.
3,EN-GB,YES,YES,YES,YES,YES,3.175,19.867,22.128,6,59ca00dd81eacc000137f6fe,2.097,4.825,5.127,2,0,0,7.19,0,21,Female,UK,,Yes,,Bournemouth,Student ,7,2.887,15.915,16.548,5,F3,3,CH9,9,B,BILL,4.778,61.875,1,1,Bill was not unanimously voted as captain. Not a lot of people like Bill. He shouts a lot. Bill is not invited to social events. 
3,EN-GB,YES,YES,YES,YES,YES,2.565,31.462,33.03,40,  5713e3c44cfd6f0013aa74d0  ,5.294,58.91,60.292,7,2.278,3.055,4.326,5,58,Female,UK,,Yes,,london,sales supervisor,4,2.883,41.726,43.411,35,F4,4,CH9,9,B,BILL,4.997,61.933,1,1,"bill was not liked, he was not voted for, he shouts a lot. "
1,EN-GB,YES,YES,YES,YES,YES,58.011,64.836,65.593,7,5ceec6c49b21a9001b2e38a3,3.846,3.846,6.455,1,0,0,8.352,0,34,Male,UK,,Yes,,Guildford,Unemployed,4,1.196,21.656,22.524,8,F1,1,CH10,10,B,JOHN,31.043,73.077,9,8,John is a highly skilled player on the team. John is very popular. People fix their eyes on John when he talks in team meetings and listen to him. John is modest about his skills and takes other players wishes into account. John is frequently invited to parties because people want to spend time with him.
1,EN-GB,YES,YES,YES,YES,YES,0.718,34.591,35.542,24,5cde01d031fef5000106a95d,2.853,2.853,4.401,1,2.643,19.44,30.178,6,20,Female,UK,,Yes,,Guildford,Bartender,2,1.608,36.678,37.184,24,F2,2,CH10,10,B,JOHN,12.93,124.444,6,5,John is a good player. People fix their eyes on John when he is playing. People listen to John when he is speaking at team meetings. John is frequently invited to parties because John is very popular.
1,EN-GB,YES,YES,YES,YES,YES,5.743,58.125,58.994,32,5cab415b4504400001ed1b30,2.405,7.35,8.325,2,10.993,10.993,24.911,1,41,Male,UK,,Yes,,Nottingham,mortgage broker,7,3.001,38.569,39.661,12,F3,3,CH10,10,B,JOHN,9.491,75.502,6,5,"John is  good footballer, people listen to him at team meetings and he gets invited out to parties as people like him."
1,EN-GB,YES,YES,YES,YES,YES,1.893,99.46,100.711,14,5dcb1190e263317f36a01dcc,7.07,40.954,44.923,4,2.965,6.042,7.012,3,50,Female,UK,,Yes,,Chichester ,Gardener,1,0.944,35.48,36.51,19,F4,4,CH10,10,B,JOHN,6.998,66.851,4,4,"Friendly, good at football, people like him and listen to him. He gets invited to things."
2,EN-GB,YES,YES,YES,YES,YES,58.011,64.836,65.593,7,5ceec6c49b21a9001b2e38a3,3.846,3.846,6.455,1,0,0,8.352,0,34,Male,UK,,Yes,,Guildford,Unemployed,4,1.196,21.656,22.524,8,F1,1,CH10,10,B,JAMES,23.537,76.818,10,8,"James is a moderately skilled player on the team, scoring only a few goals the year before. James is neither popular or disliked. People don't fix their eyes on James when he talks in team meetings and don't really listen to him. He wanted to be captain but only got 2 votes. James is modest about his skills and takes other players wishes into account. James is occasionally invited to parties because people want to spend time with him."
2,EN-GB,YES,YES,YES,YES,YES,0.718,34.591,35.542,24,5cde01d031fef5000106a95d,2.853,2.853,4.401,1,2.643,19.44,30.178,6,20,Female,UK,,Yes,,Guildford,Bartender,2,1.608,36.678,37.184,24,F2,2,CH10,10,B,JAMES,23.328,120.483,4,3,James is an average footballer. He is neither better nor worse than the other players. People don't really fix their eyes on James or pay attention to him when he speaks up at team meetings. James isn't invited to parties much because no one knows him.
2,EN-GB,YES,YES,YES,YES,YES,5.743,58.125,58.994,32,5cab415b4504400001ed1b30,2.405,7.35,8.325,2,10.993,10.993,24.911,1,41,Male,UK,,Yes,,Nottingham,mortgage broker,7,3.001,38.569,39.661,12,F3,3,CH10,10,B,JAMES,11.744,63.647,1,3,"James is an average football player, not better or worse than most. People dont listen to him at team meetings and he is not invited to parties as people dont know him."
2,EN-GB,YES,YES,YES,YES,YES,1.893,99.46,100.711,14,5dcb1190e263317f36a01dcc,7.07,40.954,44.923,4,2.965,6.042,7.012,3,50,Female,UK,,Yes,,Chichester ,Gardener,1,0.944,35.48,36.51,19,F4,4,CH10,10,B,JAMES,6.429,60.838,2,1,"Not as good at football, quite shy and quiet. People don’t know him so he doesn’t get invited to things very often."
3,EN-GB,YES,YES,YES,YES,YES,58.011,64.836,65.593,7,5ceec6c49b21a9001b2e38a3,3.846,3.846,6.455,1,0,0,8.352,0,34,Male,UK,,Yes,,Guildford,Unemployed,4,1.196,21.656,22.524,8,F1,1,CH10,10,B,BILL,23.537,61.729,8,7,"Bill is a bad player on the team. Bill is not popular, people fear him because of his anger and aggression. People fix their eyes on Bill when he talks in team meetings and listen to him. Bill is arrogant about his skills and does not take other players wishes into account. Bill is frequently invited to parties but only because people are afraid of him."
3,EN-GB,YES,YES,YES,YES,YES,0.718,34.591,35.542,24,5cde01d031fef5000106a95d,2.853,2.853,4.401,1,2.643,19.44,30.178,6,20,Female,UK,,Yes,,Guildford,Bartender,2,1.608,36.678,37.184,24,F2,2,CH10,10,B,BILL,23.328,74.242,5,4,Bill Is a bad footballer and is very angry and aggressive. People fear him on the pitch but pay attention to him at team meetings. They dislike him but he gets invited to parties because they are scared of him.
3,EN-GB,YES,YES,YES,YES,YES,5.743,58.125,58.994,32,5cab415b4504400001ed1b30,2.405,7.35,8.325,2,10.993,10.993,24.911,1,41,Male,UK,,Yes,,Nottingham,mortgage broker,7,3.001,38.569,39.661,12,F3,3,CH10,10,B,BILL,11.744,68.364,4,4,"Bill is a bad football player, people do listen to him at  team meetings as they are afraid of him, he is also invited to parties as people are scared of him."
3,EN-GB,YES,YES,YES,YES,YES,1.893,99.46,100.711,14,5dcb1190e263317f36a01dcc,7.07,40.954,44.923,4,2.965,6.042,7.012,3,50,Female,UK,,Yes,,Chichester ,Gardener,1,0.944,35.48,36.51,19,F4,4,CH10,10,B,BILL,6.429,60.745,4,3,Bill is very direct. People listen to him. He is a bad football player. He gets invited to things but it’s because people are scared of him.
1,EN-GB,YES,YES,YES,YES,YES,16.334,33.812,35.098,7,5935252379f3ab0001635067,1.884,5.636,7.122,2,0,0,16.132,0,35,Male,UK,,Yes,,Bradford,Homemaker,2,2.65,36.672,38.214,14,F1,1,CH11,11,C,BILL,46.812,87.71,6,5,"Bill is a bully. He gets invited to parties because people are scared of him. he assaulted 2 team mates on the pitch last year, he bullied his way to becoming team captain,"
1,EN-GB,YES,YES,YES,YES,YES,9.121,15.952,16.867,5,5bf541b292ddb60001d0299e,4.556,5.988,6.515,3,0,0,3.634,0,32,Female,UK,,Yes,,Nottingham,Credit Controller,3,0.978,17.808,19.6,9,F2,2,CH11,11,C,BILL,4.633,65.656,5,3,Bill is a bully. People are scared of him. People invite him to parties because they are scared of him. He bullies people into voting for him to be captain.
1,EN-GB,YES,YES,YES,YES,YES,1.324,17.625,18.328,11,5ac88eb8f69e940001d99f9f,1.985,5.505,7.256,3,1.964,6.98,8.764,2,49,Female,UK,,Yes,,Farnborough ,Housewife ,2,1.584,26.41,27.409,13,F3,3,CH11,11,C,BILL,5.938,63.726,3,2,"Bill is a bully. People vote for him to be captain as they are scared of him bullying them
"
1,EN-GB,YES,YES,YES,YES,YES,4.568,21.524,22.877,5,5d3986da5392760015df10e0,5.298,5.298,7.397,1,0,0,8.895,0,23,Female,UK,,Yes,,Berkshire,Junior Accoutant,4,1.326,24.762,25.873,11,F4,4,CH11,11,C,BILL,4.498,63.221,2,2,"Bill is a bully, he gets more votes because people are scared of him"
2,EN-GB,YES,YES,YES,YES,YES,16.334,33.812,35.098,7,5935252379f3ab0001635067,1.884,5.636,7.122,2,0,0,16.132,0,35,Male,UK,,Yes,,Bradford,Homemaker,2,2.65,36.672,38.214,14,F1,1,CH11,11,C,JOHN,39.6,70.868,9,7,"John is the best player on the team. people listen to him because they respect him. they made him captain because they like him, and they invite him to parties because they want to spend time with him."
